produto,necessidade,palavras_chave,pergunta
PABX em Nuvem,Centralizar ligações da empresa,"centralizar,celular proprio,celulares pessoais,numero unico,organizar ligacoes,organizar chamadas,empresa","Quantas pessoas precisam realizar ou receber ligações atualmente?"
Ramais adicionais,Expandir quantidade de usuários ou setores,"ramal,ramais,funcionarios,equipe cresceu,novos usuarios,setor","Quantos novos usuários ou setores precisariam de ramais?"
URA Inteligente,Automatizar o direcionamento de chamadas,"ura,menu,fila,direcionar,chamadas perdidas,alto volume,atendimento automatico","Hoje as chamadas precisam ser direcionadas para quais setores?"
Gravação de Chamadas,Registrar conversas para controle ou qualidade,"gravacao,gravar,auditoria,qualidade,monitorar conversas,registro","A gravação seria usada para auditoria, treinamento ou segurança?"
Relatórios de Chamadas,Acompanhar produtividade e indicadores,"relatorio,relatorios,acompanhar,controle,vendedores,produtividade,indicadores","Quais indicadores de ligações seriam importantes para sua gestão?"
